{"record_type":"manifest","schema_id":"ghostrace.export-manifest","schema_version":1,"registry_version":1,"export_version":1,"tool_version":"0.0.1","event_schema_version":1,"ordering_contract_version":1,"correlation_rule_registry_version":1,"correlation_rule_version":2,"schema_versions":{"claim":1,"event":1,"gap":1,"manifest":1,"policy":1,"source_coverage":1},"record_counts":{"claim":0,"event":1,"gap":0,"policy":0,"source_coverage":0},"byte_counts":{"claim":0,"event":256,"gap":0,"policy":0,"source_coverage":0},"record_digests":{"claim":"e3b0c44298fc1c149afbf4c8996fb92427ae41e4649b934ca495991b7852b855","event":"0000000000000000000000000000000000000000000000000000000000000000","gap":"e3b0c44298fc1c149afbf4c8996fb92427ae41e4649b934ca495991b7852b855","policy":"e3b0c44298fc1c149afbf4c8996fb92427ae41e4649b934ca495991b7852b855","source_coverage":"e3b0c44298fc1c149afbf4c8996fb92427ae41e4649b934ca495991b7852b855"},"query_scope":{"kind":"all_committed","source":null,"observed_from":null,"observed_until":null,"include_coverage":true},"policy_profiles":[{"id":"fixture-default-v1","version":1}],"coverage":{"event_count":1,"gap_count":0,"warning":null},"collector_status":"running","gaps":[]}
